{
  "id": "i4-test",
  "name": "Test 2.0 Turbo Inline-4",
  "inspiredBy": "Test fixture (no real car)",
  "set": "euro",
  "notes": "Phase 2a DSP test fixture. Invented but plausible values; not sourced, not a real car. Even-fire 1-3-4-2, equal headers (B8).",
  "spec": {
    "layout": {"type": "inline", "bankAngleDeg": 0, "crank": "n/a", "displacementL": 1.98},
    "cycleDeg": 720,
    "combustion": [
      {"angleDeg": 0, "bank": 0},
      {"angleDeg": 540, "bank": 0},
      {"angleDeg": 180, "bank": 0},
      {"angleDeg": 360, "bank": 0}
    ],
    "rpm": {
      "idle": 750,
      "redline": 6500,
      "limiter": {"type": "ignition-soft", "rpm": 6600, "hysteresisRpm": 150}
    },
    "aspiration": {"type": "turbo", "turbo": {"count": 1, "layout": "single"}, "supercharger": null},
    "gearbox": {
      "type": "dct",
      "overallRatios": [13.56, 9.03, 6.06, 4.42, 3.39, 2.78, 2.29],
      "drivenTyre": "225/40R18",
      "shiftTimeS": 0.1,
      "tc": null
    },
    "sources": {
      "layout": ["fixture"],
      "combustion": ["fixture"],
      "rpm": ["fixture"],
      "aspiration": ["fixture"],
      "gearbox": ["fixture"]
    }
  },
  "voicing": {
    "pulse": {"widthDeg": 55, "alpha": 9, "beta": 4, "evoOffsetDeg": 140, "cycleAsymmetry": 0.05, "cylinderSpreadDb": 0},
    "headersM": [0.6, 0.6, 0.6, 0.6],
    "collectors": [{"banks": [0], "lengthM": 0.35}],
    "turbine": {"reflection": 0.45, "lpHz": 1500},
    "exhaust": {
      "midPipeM": 1.4,
      "mufflerSectionsM": [0.21, 0.34, 0.47],
      "mufflerAction": 0.6,
      "tailpipeM": 0.5,
      "valve": {"fitted": true, "openGainDb": 4}
    },
    "intake": {"runnerM": 0.3, "helmholtzHz": 140, "gain": 0.4},
    "forcedInduction": {"spoolTimeS": 0.6, "maxShaftKrpm": 180, "lift": "bov", "cabinGainDb": -10, "whistleDb": 0, "outsideGainDb": 0},
    "mechanical": {"blockGain": 0.3, "valvetrainGain": 0.1},
    "overrun": {"crackleRate": 0.6, "fuelCutResumeRpm": 1250},
    "cabin": {"lowpassHz": 710, "leakDb": -60, "boomHz": 100, "boomDb": 0},
    "launchRpm": 2900,
    "estimated": true
  }
}
